Place_Name,Place_Ratings,Description,City,Category
Pantai Marina,2,"Pantai Marina (bahasa Jawa: ꦥꦱꦶꦱꦶꦂ​ꦩꦫꦶꦤ, translit. Pasisir Marina) adalah salah satu objek wisata pantai yang berada di kota Semarang, Jawa Tengah. Pantai ini menyimpan pemandangan eksotis khas kota Semarang. Dahulu, tempat ini merupakan hutan bakau dan tambak, tapi pemerintah setempat mengubahnya menjadi tempat rekreasi dengan cara reklamasi daratan. Hasil reklamasi dari hutan bakau ini, sekarang berupa perumahan, pertokoan, dan perkantoran, di sebelah selatan pantai.
",Semarang,Bahari
Museum Kereta Ambarawa,3,"Museum Kereta Api Ambarawa (bahasa Inggris: Indonesian Railway Museum, Ambarawa) adalah sebuah stasiun kereta api yang sudah dialihfungsikan menjadi sebuah museum serta merupakan museum perkeretaapian pertama di Indonesia. Museum ini memiliki koleksi kereta api yang pernah berjaya pada zamannya. Museum ini secara administratif berada di Desa Panjang, Ambarawa, Semarang. Museum yang terletak pada ketinggian +474,40 meter ini termasuk dalam Daerah Operasi IV Semarang dan dikelola oleh Unit Pusat Pelestarian dan Desain Arsitektur PT Kereta Api Indonesia bekerja sama dengan Pemerintah Provinsi Jawa Tengah.",Semarang,Budaya
Grand Maerakaca,4,"Masyarakat Jawa Tengah mungkin sudah tidak asing dengan nama “Puri Maerokoco”. Taman wisata ini merupakan “Taman Mini” versi Jawa Tengah yang menyajikan replika dan miniatur bangunan khas dari berbagai daerah di Jawa Tengah. Saat ini, Puri Maerakaca sudah berganti nama menjadi Grand Maerakaca. Dengan wahana yang lebih bervariasi, taman rekreasi ini menjadi salah satu destinasi wisata di Semarang yang cocok untuk rekreasi keluarga.",Semarang,Taman Hiburan
Wisata Eling Bening,3,"Sebuah fasilitas wisata yang dikelola dengan cara modern, untuk menimbulkan kenikmatan berwisata seperti halnya yang diinginkan oleh anak-anak muda. Namun tetap menyatu dengan lingkungan, dengan keindahan alam. Tanpa melakukan kerusakan terhadap alam. Fasilitas wisata ini adalah wisata Eling Bening di perbukitan Ngrawan. Eling Bening sejatinya sebuah Restoran yang mengusung konsep wisata keluarga. Eling Bening menawarkan pemandangan alam yang sangat indah dengan view utama Rawa Pening. Keindahan itu disempurnakan lagi dengan  adanya background Gunung Merbabu, Andong dan Telomoyo, yang terlihat berdiri dengan gagah.
",Semarang,Cagar Alam
Brown Canyon,2,"Di Indonesia, Brown Canyon adalah sebuah bekas penambangan tanah di Meteseh, Tembalang, Semarang. Lokasi ini menjadi salah satu lokasi (bukan tempat wisata) yang populer di Semarang dan dianggap mirip dengan Grand Canyon di Amerika Serikat. Kemiripan ini terletak pada bukit-bukit yang berubah menjadi tebing-tebing curam.",Semarang,Cagar Alam
Kampung Tematik Jawi,5,"Tak dipungkiri lagi kalau Kampung Jawi Gunungpati Semarang memang sudah viral bahkan banyak dikunjungi masyarakat. Padahal wisata kuliner ini berawal dari kampung kecil, namun kini sudah banyak didatangi baik dari penduduk lokal hingga luar kota. Ketenaran pun kini juga kerap menghiasi lama sosmed. Saat mengunjungi Kampung Jawi Gunungpati ini kamu bisa merasakan atmosfer pedesaan tempo dulu. Selain itu, nuansa malam juga damai dan malam plus pencahayaan yang remang-remang, karena memang pakai lampu Sentir (lampu minyak). Jadi asik banget kalau untuk nongkrong lama-lama.",Semarang,Budaya
Durian Gardens and Tourism Education Watu Simbar,2,"Perlu diketahui, watu simbar ini merupakan lokasi wisata yang menawarkan edukasi dari berbagai macam pohon durian. Walaupun terkesan biasa saja, hal tersebut lah yang sebenarnya menjadi keunikan tempat ini. Apabila seseorang datang kemari, orang tersebut akan bisa mempelajari banyak hal tentang pohon durian. Selain bisa mempelejari berbagai macam hal tentang pohon durian tersebut, tentu lah para pengunjung pun bisa membeli durian yang berada disana.",Semarang,Cagar Alam
Wisata Lereng Kelir,2,Wisata yang ada di kawasan gunung Kelir ini memang mulai populer sejak awal tahun 2021 dan para wisatawan kerap berbondong-bondong menuju kesana untuk meredam rasa penasaran tentang destinasi baru tersebut. Gunung Kelir memiliki ketinggian lebih dari 2000 mdpl dan wisata Lereng kelir berada diatas ketinggian mencapai 1384 mdpl dan 700mdpl Dari ketinggian tersebut membuat hampir seluruh kawasan kota Ambarawa bisa terlihat dan sebagian kecil wilayah Semarang selatan. Wisata gardu pandang Lereng Kelir memang bisa dikatakan lebih tinggi dari tempat wisata gardu pandang lainnya yang ada di Jawa Tengah.,Semarang,Cagar Alam
Kampoeng Kopi Banaran,2,"Kampoeng Kopi Banaran, sebuah agro wisata perkebunan kopi di Kabupaten Semarang. Tempat wisata ini memiliki luas 462 hektar yang sebagian dijadikan resort dan tempat wisata. Lokasinya berada di Areal Perkebunan Kopi Kebun Getas Afdeling Assinan tepatnya Jl. Raya Semarang – Solo Km. 35. Lokasi Kampoeng Kopi Banaran yang berada di ketinggian 480 – 600m dpl membuat suhu udara disana sejuk antara 23ºC – 27ºC. Jadi cocok banget buat pelesir mencari udara dingin dan segar dengan pemandangan indah. Menghilangkan penat kesibukan Kota besar, di tengah perkebunan yang asri.",Semarang,Taman Hiburan
Semarang Chinatown,2,"Terbentuknya Pecinan Semarang tak terlepas dari Geger Pecinan di Batavia (Jakarta tempo dulu) pada 1740. Kala itu warga Tionghoa memberontak pada penguasa Belanda. Buntut dari tragedi tersebut, banyak penduduk keturunan Tiongkok melarikan diri ke sepanjang pantai utara Jawa hingga akhirnya sampai di Semarang. Hingga 1743, pemberontakan masih terus berlangsung hingga akhirnya mampu dihentikan total oleh tentara Belanda. Pemerintah kolonial lantas memutuskan untuk mengumpulkan warga Tionghoa dalam satu lokasi. Setelah sempat menempati daerah Simongan dekat Klenteng Sam Poo Kong, mereka kemudian dipindah ke Kali Semarang hingga akhirnya dikenal sebagai kawasan Pecinan sampai sekarang.",Semarang,Budaya
Pura Giri Natha,5,"Awal berdirinya Pura Agung Giri Natha tidak terlepas dari hadirnya pemeluk umat Hindu dari berbagai daerah yang mulai berdatangan dan menetap di Semarang. Sebelum menetap, umat Hindu yang ada di Semarang awalnya datang untuk bekerja dan mencari ilmu. Sekitar tahun 1967/1968 para pemeluk agama Hindu yang ada di Semarang mengusulkan kepada pemerintah Semarang, untuk dibangunnya tempat peribadatan. Karena sebelumnya umat Hindu ketika melaksanakan sembahyang lokasinya dari rumah ke rumah. Setuju dengan usulan tersebut, akhirnya pemerintah Semarang memberikan pilihan beragam lokasi yang sekira tepat dan pas untuk dibangun sebuah tempat suci yakni pura.",Semarang,Budaya
La Kana Chapel,3,"La Kana Chapel menawarkan konsep baru standing party, manjakan selera Anda dengan menu memasak langsung spesial masakan segar ala menit di piring Anda. Ini adalah Tempat Pernikahan Kerajaan di Tempat Terindah di Gunung. Bagi Anda yang menginginkan Sentuhan Kemewahan dan Glamour untuk Pesta Outdoor dan Indoor. Kapel La Kana dapat menampung hingga 48 orang di kapel dan 500 lebih di halaman. Dan ballroom dapat menampung 1000 orang",Semarang,Taman Hiburan
Taman Tabanas,2,"Taman Tabanas merupakan sebuah taman yang letaknya berada di Tanjakan Gombel Semarang. Dari Taman Tabanas Semarang ini pengunjung bisa melihat landscape pemandangan kota Semarang menjadikan Taman Tabanas ini menjadi salah satu daya tarik untuk dikunjungi. Di sekitar Taman Tabanas Semarang ini terdapat Cafe, Resto dan Hotel, yang menambah indah dan menjadi satu daya tarik tersendiri Taman Tabanas Semarang. Taman Tabanas juga memiliki nama Gardu Pandang Gombel Semarang meski warga Semarang sendiri lebih mengnal taman ini dengan nama Taman Tabanas.",Semarang,Taman Hiburan
Flower Farm Setiya Aji,2,"Di taman bunga Setiya Aji Flower Farm kita bisa melihat warna-warni bunga krisan yang terlihat sangat cantik. Selain itu lokasinya yang berada di dataran tinggi membuat udara di kebun bunga Bandungan ini terasa cukup segar. Taman bunga Setiya Aji Flower Farm Bandungan ini dalam sekejab menarik perhatian wisatawan, terutama kalangan anak muda yang penasaran ingin melihat keindahan bunga-bunga di tempat wisata Semarang tersebut. Kini Setiya Aji Flower Farm menjadi salah satu tempat wisata favorit di Bandungan yang wajib dikunjungi, terutama bagi wisatawan yang sedang mencari objek wisata romantis di Kabupaten Semarang selain di Gedong Songo.",Semarang,Cagar Alam
Indonesia Kaya Park,4,"Lokasi Taman Indonesia Kaya yang berada di pusat kota Semarang, membuat taman seluas 5.000 meter persegi ini bisa difungsikan sebagai wadah berkesenian komunitas seniman Jawa Tengah. Di sini ada Panggung Budaya yang dibangun dengan dua sisi yang semuanya bisa digunakan. Lalu ada Taman Pandawa Lima yang dibuat oleh Komroden Haro, Pelataran Penikmat Seni, Amphitheater, Area Hijau, Gerbang Mural karya lima seniman muda Semarang, dan tak ketinggalan ada Air Mancur Menari. Air Mancur Menari ini dibangun oleh Pemerintah Kota Semarang yang dapat bergerak mengikuti alunan musik klasik dan lagu-lagu perjuangan Indonesia. Air Mancur Menari tersebut dijadwalkan akan menyala setiap hari pada pukul 19.00 - 20.00 dan sampai pukul 21.00 di akhir pekan.",Semarang,Taman Hiburan
Tugu Muda Semarang,3,"Tugu Muda (""Monumen Pemuda"" Indonesia) adalah sebuah monumen batu di Semarang, Jawa memperingati perjuangan kemerdekaan oleh pemuda Indonesia. Itu didedikasikan oleh Presiden Sukarno pada 20 Mei 1953 untuk memperingati pertempuran lima hari terus menerus antara pemuda Semarang dan batalyon Jepang yang dipimpin oleh Mayor Kido dari 14-19 Oktober 1945. Pasukan Jepang mengusir Belanda dari Indonesia sebagai ""kakak laki-laki Asia""; namun, Jepang lebih kejam terhadap pembangkang daripada rekan-rekan Belanda mereka. Tugu batu tersebut terdiri dari sebuah pondasi, badan dan kepala. Satu sisi tugu dibuat dalam relief, dengan kolam hias dan taman yang mengelilinginya.",Semarang,Budaya
Kampoeng Rawa,3,"Kampoeng Rawa (disebut juga Kampung Rawa) adalah objek wisata di Ambarawa, Jawa Tengah, yang terletak di sabuk hijau di sekitar Danau Rawa Pening. Dibuka pada Agustus 2012, tempat ini dimiliki dan dioperasikan oleh dua belas kelompok petani dan nelayan yang didanai oleh Artha Prima Credit Union. Kompleks tersebut dimaksudkan untuk mempengaruhi kesejahteraan petani dan melayani lokal disamping mempromosikan ekologi danau di wilayah tersebut. Fasilitasnya meliputi restoran mengapung, pendopo, pusat kerajinan, tempat memancing, dan dok. Pada hari libur, tempat ini dikunjungi oleh ratusan pengunjung. Kompleks ini disengketakan perizinannya karena dibangun di sabuk hijau dan kemungkinan dampak ekologinya.",Semarang,Cagar Alam
Candi Gedong Songo,3,"Candi Gedong Songo (bahasa Jawa: ꦕꦤ꧀ꦝꦶ​ꦒꦼꦝꦺꦴꦁ​ꦱꦔ, translit. Candhi Gedhong Sanga) adalah nama sebuah kompleks bangunan candi peninggalan budaya Hindu yang terletak di desa Candi, Kecamatan Bandungan, Kabupaten Semarang, Jawa Tengah, Indonesia tepatnya di lereng Gunung Ungaran. Di kompleks candi ini terdapat sembilan buah candi.\nCandi ini diketemukan oleh Raffles pada tahun 1804 dan merupakan peninggalan budaya Hindu dari zaman Wangsa Syailendra abad ke-9 (tahun 927 masehi).Candi ini memiliki persamaan dengan kompleks Candi Dieng di Wonosobo. Candi ini terletak pada ketinggian sekitar 1.200 m di atas permukaan laut sehingga suhu udara di sini cukup dingin (berkisar antara 19-27 °C)\nLokasi sembilan candi yang tersebar di lereng Gunung Ungaran ini memiliki pemandangan alam yang indah. Selain itu, objek wisata ini juga dilengkapi dengan pemandian air panas dari mata air yang mengandung belerang, area perkemahan, dan wisata berkuda.",Semarang,Budaya
Pura Giri Natha,2,"Awal berdirinya Pura Agung Giri Natha tidak terlepas dari hadirnya pemeluk umat Hindu dari berbagai daerah yang mulai berdatangan dan menetap di Semarang. Sebelum menetap, umat Hindu yang ada di Semarang awalnya datang untuk bekerja dan mencari ilmu. Sekitar tahun 1967/1968 para pemeluk agama Hindu yang ada di Semarang mengusulkan kepada pemerintah Semarang, untuk dibangunnya tempat peribadatan. Karena sebelumnya umat Hindu ketika melaksanakan sembahyang lokasinya dari rumah ke rumah. Setuju dengan usulan tersebut, akhirnya pemerintah Semarang memberikan pilihan beragam lokasi yang sekira tepat dan pas untuk dibangun sebuah tempat suci yakni pura.",Semarang,Budaya
Indonesia Kaya Park,5,"Lokasi Taman Indonesia Kaya yang berada di pusat kota Semarang, membuat taman seluas 5.000 meter persegi ini bisa difungsikan sebagai wadah berkesenian komunitas seniman Jawa Tengah. Di sini ada Panggung Budaya yang dibangun dengan dua sisi yang semuanya bisa digunakan. Lalu ada Taman Pandawa Lima yang dibuat oleh Komroden Haro, Pelataran Penikmat Seni, Amphitheater, Area Hijau, Gerbang Mural karya lima seniman muda Semarang, dan tak ketinggalan ada Air Mancur Menari. Air Mancur Menari ini dibangun oleh Pemerintah Kota Semarang yang dapat bergerak mengikuti alunan musik klasik dan lagu-lagu perjuangan Indonesia. Air Mancur Menari tersebut dijadwalkan akan menyala setiap hari pada pukul 19.00 - 20.00 dan sampai pukul 21.00 di akhir pekan.",Semarang,Taman Hiburan
Taman Bunga Celosia,2,"Wisata Semarang menawarkan berbagai tempat wisata menarik. Salah satunya yaitu berkunjung ke Taman Bunga Celosia Bandungan. Lokasinya berada di kaki Gunung Ungaran, Semarang. Menawarkan pemandangan sekitar yang alami dengan panorama pegunungan Ungaran merupakan daya tarik utama taman rekreasi ini. Begitu sampai di sini area parkir yang luas langsung menyambut dan tak ketinggalan gapura selamat datang. Sepanjang perjalanan menuju ke loket tiket, terdapat pagar berbentuk pensil raksasa warna warni. Sebagai tambahan di sekitar pagar terdapat bunga warna-warni yang menghiasi perjalanan menuju loket masuk.",Semarang,Cagar Alam
Kampung Batik Gedong Semarang,4,"Kampung Batik Semarang merupakan salah satu kampung di Kota Semarang yang unik dan menarik yang selalu dikaitkan dengan batik Semarang sejak zaman dulu hingga sekarang. Kampung Batik Semarang ini letaknya ada di seputar daerah Bubagan Semarang. Kampung Batik Semarang dalam sejarah dari tahun 1970 sampai 1980 an, pada saat itu mati total tidak ada aktivitas membatik. Baru kemudian pada tahun 2005 mulai ada kegiatan, hal ini berlangsung karena ada anggapan “kok namanya Kampung Batik Semarang”. Akan tetapi, kok tidak ada orang yang membatik, maka mulailah kegiatan seperti pelatihan membatik sering digalakan, hal ini bertujuan untuk memfasilitasi dan merevitalisasi Kampung Batik Semarang. Pada waktu itu terkenal dengan Batik Krajan, Batik Gedong, Batik Tengah, Batik Malang, Batik Kubur Sari dan Batik Kandang Wedus yang terkenal dengan motifnya sendiri-sendiri. Akan tetapi sayang motif itu tidak terekam secara visual, dan ini sebenarnya menjadi harta karun yang belum ditemukan sampai sekarang visual pada motif batik-batik ini.",Semarang,Budaya
Goa Rong,4,"Semarang memiliki wisata di ketinggian bernama Goa Rong. Keberadaan kawasan wisata ini menunjukkan bahwa Semarang tak hanya identik dengan Lawang Sewu atau Kota Lama saja. Meskipun bernama Goa Rong, tempat yang menonjol di sini bukanlah gua nya. Melainkan daerah ketinggian dengan pemandangan yang menakjubkan. Sementara di objek wisata ini, bagian gua-nya hanya lorong yang sempit dan tidak memungkinkan dimasuki oleh manusia. Namun sebaliknya, pemandangan yang tersaji dari atas bukitnya begitu menakjubkan. Wisatawan dapat menghabiskan waktu dengan berfoto, menikmati pemandangan, atau kuliner di cafe. Bahkan, tersedia juga fasilitas outbond.",Semarang,Cagar Alam
Semarang Chinatown,4,"Terbentuknya Pecinan Semarang tak terlepas dari Geger Pecinan di Batavia (Jakarta tempo dulu) pada 1740. Kala itu warga Tionghoa memberontak pada penguasa Belanda. Buntut dari tragedi tersebut, banyak penduduk keturunan Tiongkok melarikan diri ke sepanjang pantai utara Jawa hingga akhirnya sampai di Semarang. Hingga 1743, pemberontakan masih terus berlangsung hingga akhirnya mampu dihentikan total oleh tentara Belanda. Pemerintah kolonial lantas memutuskan untuk mengumpulkan warga Tionghoa dalam satu lokasi. Setelah sempat menempati daerah Simongan dekat Klenteng Sam Poo Kong, mereka kemudian dipindah ke Kali Semarang hingga akhirnya dikenal sebagai kawasan Pecinan sampai sekarang.",Semarang,Budaya
La Kana Chapel,5,"La Kana Chapel menawarkan konsep baru standing party, manjakan selera Anda dengan menu memasak langsung spesial masakan segar ala menit di piring Anda. Ini adalah Tempat Pernikahan Kerajaan di Tempat Terindah di Gunung. Bagi Anda yang menginginkan Sentuhan Kemewahan dan Glamour untuk Pesta Outdoor dan Indoor. Kapel La Kana dapat menampung hingga 48 orang di kapel dan 500 lebih di halaman. Dan ballroom dapat menampung 1000 orang",Semarang,Taman Hiburan
Kampung Batik Gedong Semarang,5,"Kampung Batik Semarang merupakan salah satu kampung di Kota Semarang yang unik dan menarik yang selalu dikaitkan dengan batik Semarang sejak zaman dulu hingga sekarang. Kampung Batik Semarang ini letaknya ada di seputar daerah Bubagan Semarang. Kampung Batik Semarang dalam sejarah dari tahun 1970 sampai 1980 an, pada saat itu mati total tidak ada aktivitas membatik. Baru kemudian pada tahun 2005 mulai ada kegiatan, hal ini berlangsung karena ada anggapan “kok namanya Kampung Batik Semarang”. Akan tetapi, kok tidak ada orang yang membatik, maka mulailah kegiatan seperti pelatihan membatik sering digalakan, hal ini bertujuan untuk memfasilitasi dan merevitalisasi Kampung Batik Semarang. Pada waktu itu terkenal dengan Batik Krajan, Batik Gedong, Batik Tengah, Batik Malang, Batik Kubur Sari dan Batik Kandang Wedus yang terkenal dengan motifnya sendiri-sendiri. Akan tetapi sayang motif itu tidak terekam secara visual, dan ini sebenarnya menjadi harta karun yang belum ditemukan sampai sekarang visual pada motif batik-batik ini.",Semarang,Budaya
Kampoeng Rawa,2,"Kampoeng Rawa (disebut juga Kampung Rawa) adalah objek wisata di Ambarawa, Jawa Tengah, yang terletak di sabuk hijau di sekitar Danau Rawa Pening. Dibuka pada Agustus 2012, tempat ini dimiliki dan dioperasikan oleh dua belas kelompok petani dan nelayan yang didanai oleh Artha Prima Credit Union. Kompleks tersebut dimaksudkan untuk mempengaruhi kesejahteraan petani dan melayani lokal disamping mempromosikan ekologi danau di wilayah tersebut. Fasilitasnya meliputi restoran mengapung, pendopo, pusat kerajinan, tempat memancing, dan dok. Pada hari libur, tempat ini dikunjungi oleh ratusan pengunjung. Kompleks ini disengketakan perizinannya karena dibangun di sabuk hijau dan kemungkinan dampak ekologinya.",Semarang,Cagar Alam
Jembatan Biru Ambarawa,5,"Jembatan ini terletak di Tuntang, Kab. Semarang, Jawa tengah. dekat dengan rawa pening dan Sungai Tuntang. Kalau yang biasa mondar mandir salatiga-semarang, pasti tidak asing dengan yang namanya Jembatan Tuntang. Nah.. Sungai Tuntang ini berada tepat di bawah Jembatan tuntang yang bermuara di Rawa Pening. Bagi pengunjung yang senang berfoto, Wisata Jembatan Biru memiliki beberapa spot foto terbaik, salah satunya adalah di tengah jembatan. Jika beruntung, pengunjung juga akan melihat kereta uap yang melintas di depan tempat Wisata Jembatan Biru. Dari atas jembatan pengunjung juga bisa melihat Gunung Ungaran, Gunung Temoloyo dan juga Gunung Merbabu.",Semarang,Taman Hiburan
Hutan Wisata Tinjomoyo Semarang,5,"Awalnya taman wisata hutan Tinjomoyo Semarang (smg) ini merupakan sebuah kebun binatang dengan ragam binatang hutan di dalamnya. Namun terjadi banjir besar, hingga memutuskan jembatan besar yang menjadi akses utama menuju hutan wisata. Hutan Tinjomoyo sendiri memiliki kontur wilayah dengan perpaduan bukit, sungai dan hutan. Tumbuhan yang paling banyak terdapat di sini adalah vegetasi pohon jati serta pinus. Oleh karena itu, tak heran jika kawasan ini cocok sekali dijadikan hutan wisata yang masih alami.Dengan luas lahan 57,5 hektare area tersebut lebih sering dimanfaatkan sebagai tempat berkemah",Semarang,Cagar Alam
Pantai Marina,3,"Pantai Marina (bahasa Jawa: ꦥꦱꦶꦱꦶꦂ​ꦩꦫꦶꦤ, translit. Pasisir Marina) adalah salah satu objek wisata pantai yang berada di kota Semarang, Jawa Tengah. Pantai ini menyimpan pemandangan eksotis khas kota Semarang. Dahulu, tempat ini merupakan hutan bakau dan tambak, tapi pemerintah setempat mengubahnya menjadi tempat rekreasi dengan cara reklamasi daratan. Hasil reklamasi dari hutan bakau ini, sekarang berupa perumahan, pertokoan, dan perkantoran, di sebelah selatan pantai.
",Semarang,Bahari
Sam Poo Kong Temple,3,"Sam Poo Kong (Hanzi: ; Pinyin: Sānbǎo Dòng), juga dikenal sebagai Kuil Gedung Batu, adalah kuil Tionghoa tertua di Semarang, Jawa Tengah, Indonesia. Awalnya didirikan oleh penjelajah Muslim Tionghoa Zheng He (juga dikenal sebagai Sanbao), sekarang dibagi oleh orang Indonesia dari berbagai denominasi agama, termasuk Muslim dan Budha, dan etnis, termasuk Tionghoa dan Jawa.",Semarang,Budaya
Hutan Wisata Tinjomoyo Semarang,4,"Awalnya taman wisata hutan Tinjomoyo Semarang (smg) ini merupakan sebuah kebun binatang dengan ragam binatang hutan di dalamnya. Namun terjadi banjir besar, hingga memutuskan jembatan besar yang menjadi akses utama menuju hutan wisata. Hutan Tinjomoyo sendiri memiliki kontur wilayah dengan perpaduan bukit, sungai dan hutan. Tumbuhan yang paling banyak terdapat di sini adalah vegetasi pohon jati serta pinus. Oleh karena itu, tak heran jika kawasan ini cocok sekali dijadikan hutan wisata yang masih alami.Dengan luas lahan 57,5 hektare area tersebut lebih sering dimanfaatkan sebagai tempat berkemah",Semarang,Cagar Alam
Umbul Sidomukti,4,"Kawasan wisata umbul Sidomukti merupakan salah satu Wisata Alam Pegunungan di Semarang, berada di Desa Sidomukti Kecamatan Bandungan Kabupaten Semarang. Kawasan wisata ini dengan didukung fasiltas & Servis: Outbond Training, Adrenalin Games, Taman Renang Alam, Camping Ground, Pondok Wisata, Pondok Lesehan, serta Meeting Room.",Semarang,Cagar Alam
Jembatan Biru Ambarawa,2,"Jembatan ini terletak di Tuntang, Kab. Semarang, Jawa tengah. dekat dengan rawa pening dan Sungai Tuntang. Kalau yang biasa mondar mandir salatiga-semarang, pasti tidak asing dengan yang namanya Jembatan Tuntang. Nah.. Sungai Tuntang ini berada tepat di bawah Jembatan tuntang yang bermuara di Rawa Pening. Bagi pengunjung yang senang berfoto, Wisata Jembatan Biru memiliki beberapa spot foto terbaik, salah satunya adalah di tengah jembatan. Jika beruntung, pengunjung juga akan melihat kereta uap yang melintas di depan tempat Wisata Jembatan Biru. Dari atas jembatan pengunjung juga bisa melihat Gunung Ungaran, Gunung Temoloyo dan juga Gunung Merbabu.",Semarang,Taman Hiburan
Monumen Palagan Ambarawa,5,"Monumen Palagan Ambarawa adalah sebuah monumen yang terdapat di Ambarawa, Kabupaten Semarang.\nMonumen ini merupakan simbol untuk mengenang sejarah pertempuran Palagan Ambarawa pada tanggal 12 Desember - 15 Desember 1945 Ambarawa. Pasukan Sekutu yang terdesak dari Magelang mengadakan pengunduran ke Ambarawa, dan pasukan TKR yang dipimpin Kolonel Soedirman berhasil menghancurkan Sekutu pada tanggal 15 Desember 1945, di mana kini diperingati sebagai Hari Infanteri.Monumen Palagan Ambarawa dibangun pada tahun 1973 dan diresmikan pada 15 Desember 1974 oleh Presiden Soeharto. Gambaran singkat sejarah pertempuran bisa dilihat pada relief yang dibuat pada dinding Monumen Palagan Ambarawa.\nDi monumen ini Anda dapat menemukan peninggalan pemerintahan Jepang dan Belanda. Anda dapat melihat seragam para tentara Jepang dan Belanda, senjata perang, seragam tentara Indonesia, dan barang bersejarah lain. Untuk ukuran yang agak besar, Anda dapat menemukan beberapa tank kuno, kendaraa angkut personil dan meriam yang digunakan dalam pertempuran tersebut. Yang paling menarik adalah Anda dapat menemukan pesawat Mustang Belanda yang berhasil ditembak jatuh ke dalam Rawa Pening
",Semarang,Budaya
Wisata Eling Bening,5,"Sebuah fasilitas wisata yang dikelola dengan cara modern, untuk menimbulkan kenikmatan berwisata seperti halnya yang diinginkan oleh anak-anak muda. Namun tetap menyatu dengan lingkungan, dengan keindahan alam. Tanpa melakukan kerusakan terhadap alam. Fasilitas wisata ini adalah wisata Eling Bening di perbukitan Ngrawan. Eling Bening sejatinya sebuah Restoran yang mengusung konsep wisata keluarga. Eling Bening menawarkan pemandangan alam yang sangat indah dengan view utama Rawa Pening. Keindahan itu disempurnakan lagi dengan  adanya background Gunung Merbabu, Andong dan Telomoyo, yang terlihat berdiri dengan gagah.
",Semarang,Cagar Alam
Semarang Chinatown,5,"Terbentuknya Pecinan Semarang tak terlepas dari Geger Pecinan di Batavia (Jakarta tempo dulu) pada 1740. Kala itu warga Tionghoa memberontak pada penguasa Belanda. Buntut dari tragedi tersebut, banyak penduduk keturunan Tiongkok melarikan diri ke sepanjang pantai utara Jawa hingga akhirnya sampai di Semarang. Hingga 1743, pemberontakan masih terus berlangsung hingga akhirnya mampu dihentikan total oleh tentara Belanda. Pemerintah kolonial lantas memutuskan untuk mengumpulkan warga Tionghoa dalam satu lokasi. Setelah sempat menempati daerah Simongan dekat Klenteng Sam Poo Kong, mereka kemudian dipindah ke Kali Semarang hingga akhirnya dikenal sebagai kawasan Pecinan sampai sekarang.",Semarang,Budaya
Danau Rawa Pening,2,"Rawa Pening (pening adalah salah satu varian bahasa Jawa dari kata ""wening"" yang artinya hening, tenang, damai) (bahasa Jawa: ꦫꦮ​ꦥꦼꦤꦶꦁ, translit. Rawa Pening) adalah danau alam di Kabupaten Semarang, Jawa Tengah. Dengan luas 2.670 hektare ia menempati wilayah Kecamatan Ambarawa, Bawen, Tuntang, dan Banyubiru.Rawa Pening terletak di cekungan terendah lereng Gunung Merbabu, Gunung Telomoyo, dan Gunung Ungaran. Danau ini dangkal dan menjadi hulu bagi Sungai Tuntang.
",Semarang,Cagar Alam
