Place_Name,Place_Ratings,Description,City,Category
Kampung Pelangi,5,"Kampung pelangi atau dalam bahasa Inggris disebut Rainbow Village merupakan sebutan untuk daerah atau kampung yang rumah-rumah penduduknya dicat dengan warna-warni. Sebenarnya Kampung Pelangi pada awalnya merupakan daerah kumuh yang dikemudian secara kreatif diubah menjadi daerah yang menarik untuk dijadikan sebagai destinasi wisata, terutama bagi masyarakat yang senang atau sedang mencari spot yang menarik untuk mengabadikan momen.\nBanyak daerah-daerah di Indonesia, terutama di jawa memliki tempat yang disebut Kampung pelangi, antara lain di Malang, Semarang, Jakarta, Bandung, dan kota-kota lainnya. Contoh kampung seperti ini yaitu, kampung warna-warni di Jodipan dan Tridi, Kota Malang, Jawa Timur.",Semarang,Taman Hiburan
GPIB Immanuel Semarang (Gereja Blenduk),2,"GPIB Immanuel Semarang (populer dengan nama Gereja Blenduk, kadang-kadang dieja Gereja Blendug, dan sering kali dilafazkan sebagai mBlendhug) (bahasa Jawa: ꦒꦿꦺꦗ​ꦧ꧀ꦭꦼꦤ꧀ꦝꦸꦏ꧀, translit. Gréja Blendhuk) adalah Gereja Kristen tertua di Jawa Tengah yang dibangun oleh masyarakat Belanda yang tinggal di kota itu pada 1753, dengan bentuk oktagonal (persegi delapan). Gereja ini sesungguhnya bernama Gereja GPIB Immanuel, di Jl. Letjend. Suprapto 32. Kubahnya besar, dilapisi perunggu, dan di dalamnya terdapat sebuah orgel Barok. Arsitektur di dalamnya dibuat berdasarkan salib Yunani. Gereja ini direnovasi pada 1894 oleh W. Westmaas dan H.P.A. de Wilde, yang menambahkan kedua menara di depan gedung gereja ini. Nama Blenduk adalah julukan dari masyarakat setempat yang berarti kubah. Gereja ini hingga sekarang masih dipergunakan setiap hari Minggu. Di sekitar gereja ini juga terdapat sejumlah bangunan lain dari masa kolonial Belanda.
",Semarang,Tempat Ibadah
Grand Maerakaca,3,"Masyarakat Jawa Tengah mungkin sudah tidak asing dengan nama “Puri Maerokoco”. Taman wisata ini merupakan “Taman Mini” versi Jawa Tengah yang menyajikan replika dan miniatur bangunan khas dari berbagai daerah di Jawa Tengah. Saat ini, Puri Maerakaca sudah berganti nama menjadi Grand Maerakaca. Dengan wahana yang lebih bervariasi, taman rekreasi ini menjadi salah satu destinasi wisata di Semarang yang cocok untuk rekreasi keluarga.",Semarang,Taman Hiburan
Monumen Palagan Ambarawa,3,"Monumen Palagan Ambarawa adalah sebuah monumen yang terdapat di Ambarawa, Kabupaten Semarang.\nMonumen ini merupakan simbol untuk mengenang sejarah pertempuran Palagan Ambarawa pada tanggal 12 Desember - 15 Desember 1945 Ambarawa. Pasukan Sekutu yang terdesak dari Magelang mengadakan pengunduran ke Ambarawa, dan pasukan TKR yang dipimpin Kolonel Soedirman berhasil menghancurkan Sekutu pada tanggal 15 Desember 1945, di mana kini diperingati sebagai Hari Infanteri.Monumen Palagan Ambarawa dibangun pada tahun 1973 dan diresmikan pada 15 Desember 1974 oleh Presiden Soeharto. Gambaran singkat sejarah pertempuran bisa dilihat pada relief yang dibuat pada dinding Monumen Palagan Ambarawa.\nDi monumen ini Anda dapat menemukan peninggalan pemerintahan Jepang dan Belanda. Anda dapat melihat seragam para tentara Jepang dan Belanda, senjata perang, seragam tentara Indonesia, dan barang bersejarah lain. Untuk ukuran yang agak besar, Anda dapat menemukan beberapa tank kuno, kendaraa angkut personil dan meriam yang digunakan dalam pertempuran tersebut. Yang paling menarik adalah Anda dapat menemukan pesawat Mustang Belanda yang berhasil ditembak jatuh ke dalam Rawa Pening
",Semarang,Budaya
Saloka Theme Park,3,"SALOKA hadir sebagai taman rekreasi terbesar di Tengah Jawa yang masuk dalam daftar destinasi wisata Pesona Indonesia, serta mengusung konsep kearifan lokal berdasarkan legenda rakyat Baru Klinthing.",Semarang,Taman Hiburan
Hutan Pinus Kayon,4,"Tak dipungkiri Hutan Pinus Kayon Getasan dekat Salatiga ini memang merupakan salah satu tempat wisata yang indah dan memanjakan mata. Pengunjung akan disuguhkan dengan jajaran hutan pinus yang rapi dan asri. Deretan pohon ini pun memang memikat dan tentunya Hutan pinus Kayon atau disebut Hutan pinus Kalipasang bisa menjadi salah satu alternatif wisata keluarga. Selain disana sudah terbilang komplit, jalan-jalan di dalam hutan pun sudah berupa cor. Dengan demikian, tentunya makin memanjakan pengunjung saat explorasi kawasan wisata ini.",Semarang,Cagar Alam
Lawang Sewu,3,"Lawang Sewu (""Seribu Pintu"") (bahasa Jawa: ꦭꦮꦁ​ꦱꦺꦮꦸ, translit. Lawang Sèwu) adalah landmark di Semarang, Jawa Tengah, Indonesia, yang dibangun sebagai kantor pusat Perusahaan Kereta Api Hindia Belanda. Bangunan era kolonial terkenal sebagai rumah berhantu dan lokasi syuting, meskipun pemerintah kota Semarang telah berusaha mengubah citra itu.",Semarang,Budaya
Brown Canyon,5,"Di Indonesia, Brown Canyon adalah sebuah bekas penambangan tanah di Meteseh, Tembalang, Semarang. Lokasi ini menjadi salah satu lokasi (bukan tempat wisata) yang populer di Semarang dan dianggap mirip dengan Grand Canyon di Amerika Serikat. Kemiripan ini terletak pada bukit-bukit yang berubah menjadi tebing-tebing curam.",Semarang,Cagar Alam
Durian Gardens and Tourism Education Watu Simbar,4,"Perlu diketahui, watu simbar ini merupakan lokasi wisata yang menawarkan edukasi dari berbagai macam pohon durian. Walaupun terkesan biasa saja, hal tersebut lah yang sebenarnya menjadi keunikan tempat ini. Apabila seseorang datang kemari, orang tersebut akan bisa mempelajari banyak hal tentang pohon durian. Selain bisa mempelejari berbagai macam hal tentang pohon durian tersebut, tentu lah para pengunjung pun bisa membeli durian yang berada disana.",Semarang,Cagar Alam
Pantai Marina,4,"Pantai Marina (bahasa Jawa: ꦥꦱꦶꦱꦶꦂ​ꦩꦫꦶꦤ, translit. Pasisir Marina) adalah salah satu objek wisata pantai yang berada di kota Semarang, Jawa Tengah. Pantai ini menyimpan pemandangan eksotis khas kota Semarang. Dahulu, tempat ini merupakan hutan bakau dan tambak, tapi pemerintah setempat mengubahnya menjadi tempat rekreasi dengan cara reklamasi daratan. Hasil reklamasi dari hutan bakau ini, sekarang berupa perumahan, pertokoan, dan perkantoran, di sebelah selatan pantai.
",Semarang,Bahari
Masjid Kapal Semarang,4,"Masjid Safinatun Najah atau pengunjung biasa menyebutnya dengan Masjid Kapal Semarang kini menjadi wisata religi yang ramai dikunjungi saat bulan Ramadan. Masjid yang berlokasi di berlokasi di Jalan Kyai Padak, Podorejo, Kec. Ngaliyan, Kota Semarang mulai ramai didatangi pengunjung saat menjelang buka puasa. Umumnya tujuan utama mereka yang datang kesini untuk beribadah, selain itu juga ada yang berburu foto serta berkuliner di sekitar kawasan masjid.",Semarang,Tempat Ibadah
Taman Srigunting,5,"Merupakan salah satu landmark di Kawasan Kota Lama Semarang, Taman Srigunting pada masa kolonial belanda berwujud parade plein untuk panggung parade, kini menjadi sebuah ruang terbuka berupa taman yang menjadi salah satu tempat untuk berkumpul atau berkegiatan komunitas. Taman Srigunting berada di Jalan Letjen Suprapto 32 Kawasan Kota Lama, di sisi selatan terdapat Gedung Marba, di barat daya terdapat Gedung Jiwasraya, di sisi barat terdapat Gereja Blenduk serta di sisi timur terdapat Gedung Kerta Niaga. Taman ini beberapa kali mengalami renovasi, seperti pada tahun 2001 dan tahun 2004. Pada tahun 2001, Taman Srigunting dikembalikan pada fungsi raung terbuka untuk rekreatif, setelah sebelumnya merupakan taman pasif. Pada tahun 2004 renovasi taman ini dengan membuat jalan masuk pada masing-masing sisi, hingga terdapat empat jalan masuk. Dan di tengah tengah dibuat tiang lampu penerangan yang bercabang empat untuk menerangi empat sisi jalan masuk tersebut.
",Semarang,Taman Hiburan
Taman Bunga Celosia,3,"Wisata Semarang menawarkan berbagai tempat wisata menarik. Salah satunya yaitu berkunjung ke Taman Bunga Celosia Bandungan. Lokasinya berada di kaki Gunung Ungaran, Semarang. Menawarkan pemandangan sekitar yang alami dengan panorama pegunungan Ungaran merupakan daya tarik utama taman rekreasi ini. Begitu sampai di sini area parkir yang luas langsung menyambut dan tak ketinggalan gapura selamat datang. Sepanjang perjalanan menuju ke loket tiket, terdapat pagar berbentuk pensil raksasa warna warni. Sebagai tambahan di sekitar pagar terdapat bunga warna-warni yang menghiasi perjalanan menuju loket masuk.",Semarang,Cagar Alam
Water Blaster Bukit Candi Golf,3,"Buat kamu yang bingung mau rekreasi kemana di Semarang, langsung saja ke Water Blaster Semarang. Waterpark yang menyediakan banyak permainan dan atraksi seru yang semuanya layak untuk dicoba. Dengan total lebih dari 20 wahana air yang siap memberikan pengalaman seru buat pecinta tantangan wahana air. Bendulan, Blaster Warior, Jungle Tree, Great Wall sedikit dari puluhan wahana lain yang bisa dimainkan. Tentu semua ditunjang dengan fasilitas yang lengkap seperti Gazebo, Family Gazebo, Vip Court, dll semua ada untuk menambah kenyamanan setiap pengunjung yang akan bermain di Waterpark kota lumpia ini.",Semarang,Taman Hiburan
Air Terjun Semirang,4,"Terletak di lereng Gunung Ungaran bagian utara, terdapat sebuah air terjun yang eksotis dengan kolam renang yang berwarna hijau yang dikelilingi popohonan dan kesejukan udara pegunungan. Nama lokasi tersebut adalah Air Terjun Semirang atau disebut juga Curug Semirang. Dan masyarakat Semarang menyebutnya dengan Curug Semarang. Karena keindahannya lokasi wisata ini sering dikunjungi oleh para wisatawan pada saat hari-hari biasa, apalagi saat liburan tiba. Air terjun Semirang atau Curug Semirang berada di kawasan hutan lindung dengan luas 10 hektar di bawah pengelolaan perum perhutani. Adapun air terjun ini memiliki ketinggian sekitar 45 meter. Jarak lokasi parkiran dengan lokasi air terjun sekitar 500 meter. Dan selama perjalanan, para pengunjung akan disuguhkan pemandangan alam yang masih asri dengan kesegaran udara yang sangat sejuk.",Semarang,Cagar Alam
Museum Kereta Ambarawa,2,"Museum Kereta Api Ambarawa (bahasa Inggris: Indonesian Railway Museum, Ambarawa) adalah sebuah stasiun kereta api yang sudah dialihfungsikan menjadi sebuah museum serta merupakan museum perkeretaapian pertama di Indonesia. Museum ini memiliki koleksi kereta api yang pernah berjaya pada zamannya. Museum ini secara administratif berada di Desa Panjang, Ambarawa, Semarang. Museum yang terletak pada ketinggian +474,40 meter ini termasuk dalam Daerah Operasi IV Semarang dan dikelola oleh Unit Pusat Pelestarian dan Desain Arsitektur PT Kereta Api Indonesia bekerja sama dengan Pemerintah Provinsi Jawa Tengah.",Semarang,Budaya
Jembatan Biru Ambarawa,4,"Jembatan ini terletak di Tuntang, Kab. Semarang, Jawa tengah. dekat dengan rawa pening dan Sungai Tuntang. Kalau yang biasa mondar mandir salatiga-semarang, pasti tidak asing dengan yang namanya Jembatan Tuntang. Nah.. Sungai Tuntang ini berada tepat di bawah Jembatan tuntang yang bermuara di Rawa Pening. Bagi pengunjung yang senang berfoto, Wisata Jembatan Biru memiliki beberapa spot foto terbaik, salah satunya adalah di tengah jembatan. Jika beruntung, pengunjung juga akan melihat kereta uap yang melintas di depan tempat Wisata Jembatan Biru. Dari atas jembatan pengunjung juga bisa melihat Gunung Ungaran, Gunung Temoloyo dan juga Gunung Merbabu.",Semarang,Taman Hiburan
Kampoeng Djadhoel Semarang,2,"Kampoeng Djadhoel terletak di Kampung Batik Semarang tepatnya di Kampung Batik Tengah RT 04/ RW 02 Kelurahan Rejomulyo, Kecamatan Semarang Timur. Penamaan Kampoeng Djadhoel ini tercetus sejak 18 Desember 2016 oleh Ignatius Luwiyanto (50) warga Kampung Batik Tengah. Sejarah Indonesia menjadi latar belakang penamaan KampoengDjadhoel.",Semarang,Budaya
Hutan Pinus Kayon,5,"Tak dipungkiri Hutan Pinus Kayon Getasan dekat Salatiga ini memang merupakan salah satu tempat wisata yang indah dan memanjakan mata. Pengunjung akan disuguhkan dengan jajaran hutan pinus yang rapi dan asri. Deretan pohon ini pun memang memikat dan tentunya Hutan pinus Kayon atau disebut Hutan pinus Kalipasang bisa menjadi salah satu alternatif wisata keluarga. Selain disana sudah terbilang komplit, jalan-jalan di dalam hutan pun sudah berupa cor. Dengan demikian, tentunya makin memanjakan pengunjung saat explorasi kawasan wisata ini.",Semarang,Cagar Alam
Wisata Lereng Kelir,3,Wisata yang ada di kawasan gunung Kelir ini memang mulai populer sejak awal tahun 2021 dan para wisatawan kerap berbondong-bondong menuju kesana untuk meredam rasa penasaran tentang destinasi baru tersebut. Gunung Kelir memiliki ketinggian lebih dari 2000 mdpl dan wisata Lereng kelir berada diatas ketinggian mencapai 1384 mdpl dan 700mdpl Dari ketinggian tersebut membuat hampir seluruh kawasan kota Ambarawa bisa terlihat dan sebagian kecil wilayah Semarang selatan. Wisata gardu pandang Lereng Kelir memang bisa dikatakan lebih tinggi dari tempat wisata gardu pandang lainnya yang ada di Jawa Tengah.,Semarang,Cagar Alam
Danau Rawa Pening,5,"Rawa Pening (pening adalah salah satu varian bahasa Jawa dari kata ""wening"" yang artinya hening, tenang, damai) (bahasa Jawa: ꦫꦮ​ꦥꦼꦤꦶꦁ, translit. Rawa Pening) adalah danau alam di Kabupaten Semarang, Jawa Tengah. Dengan luas 2.670 hektare ia menempati wilayah Kecamatan Ambarawa, Bawen, Tuntang, dan Banyubiru.Rawa Pening terletak di cekungan terendah lereng Gunung Merbabu, Gunung Telomoyo, dan Gunung Ungaran. Danau ini dangkal dan menjadi hulu bagi Sungai Tuntang.
",Semarang,Cagar Alam
Grand Maerakaca,5,"Masyarakat Jawa Tengah mungkin sudah tidak asing dengan nama “Puri Maerokoco”. Taman wisata ini merupakan “Taman Mini” versi Jawa Tengah yang menyajikan replika dan miniatur bangunan khas dari berbagai daerah di Jawa Tengah. Saat ini, Puri Maerakaca sudah berganti nama menjadi Grand Maerakaca. Dengan wahana yang lebih bervariasi, taman rekreasi ini menjadi salah satu destinasi wisata di Semarang yang cocok untuk rekreasi keluarga.",Semarang,Taman Hiburan
Wisata Alam Wana Wisata Penggaron,2,"Berada sekitar 2 KM dari Kota Ungaran atau sekitar 18 KM dari Kota Semarang, Kawasan Wana Wisata Penggaron secara administratif berada di Desa Susukan, Kecamatan Ungaran, Kabupaten semarang. Area ini merupakan salah satu hutan binaan Kesatuan Bisnis Mandiri Wisata, Benih dan Usaha Lain (KBM WBU I) Perum Perhutani Unit I Jateng. Wana Wisata Penggaron atau Wisata Alam Wana Wisata Penggaron merupakan sebuah tempat wisata hutan yang bisa anda gunakan untuk berlibur bersama keluarga anda, salah satunya untuk camping. Tempat ini banyak di jadikan sebagai tempat untuk camping atau berlibur oleh masyarakat Semarang. Wana Wisata Penggaron sebuah hutan yang eksotis, sayangnya surga di kota semarang ini jarang tersentuh mata. Bagi pengunjung yang bertanya kepada penjaga loket, dengan jawaban yang sederhana dan apa adanya “hutan biasa yang sering dipake kemah, tidak ada yang istimewa”, tentunya akan merasa kecewa.",Semarang,Cagar Alam
Watu Gunung Ungaran,2,"Objek wisata alam memang sangat cocok dikunjungi, terlebih saat akhir pekan. Ditambah lagi, lokasi objek wisata yang tidak terlalu jauh dari pusat kota. Seperti objek wisata Watu Gunung yang ada di Ungaran, Kota Semarang. Berkunjung ke wisata alam dapat membuat pikiran menjadi segar. Terlebih, objek wisata ini menawarkan wisata alam dan air yang menawan. Selain itu, dipadukan juga dengan nuansa adat Jawa yang khas. Dulunya, kawasan Watu Gunung ini bukanlah suatu objek wisata. Hanya tanah yang ditumbuhi pohon pala dan cengkeh yang lebat. Sayangnya, kawasan tersebut gersang dan susah mendapatkan air. Kemudian, di tahun 2004 sang pemilik berinisiatif untuk mendirikan villa pribadi. Dan lama kelamaan, dibuatlah objek wisata yang dibuka untuk umum. Dengan tetap mempertahankan bangunan joglo sebagai ciri khasnya.",Semarang,Cagar Alam
Kampung Pelangi,4,"Kampung pelangi atau dalam bahasa Inggris disebut Rainbow Village merupakan sebutan untuk daerah atau kampung yang rumah-rumah penduduknya dicat dengan warna-warni. Sebenarnya Kampung Pelangi pada awalnya merupakan daerah kumuh yang dikemudian secara kreatif diubah menjadi daerah yang menarik untuk dijadikan sebagai destinasi wisata, terutama bagi masyarakat yang senang atau sedang mencari spot yang menarik untuk mengabadikan momen.\nBanyak daerah-daerah di Indonesia, terutama di jawa memliki tempat yang disebut Kampung pelangi, antara lain di Malang, Semarang, Jakarta, Bandung, dan kota-kota lainnya. Contoh kampung seperti ini yaitu, kampung warna-warni di Jodipan dan Tridi, Kota Malang, Jawa Timur.",Semarang,Taman Hiburan
Kampung Tematik Jawi,2,"Tak dipungkiri lagi kalau Kampung Jawi Gunungpati Semarang memang sudah viral bahkan banyak dikunjungi masyarakat. Padahal wisata kuliner ini berawal dari kampung kecil, namun kini sudah banyak didatangi baik dari penduduk lokal hingga luar kota. Ketenaran pun kini juga kerap menghiasi lama sosmed. Saat mengunjungi Kampung Jawi Gunungpati ini kamu bisa merasakan atmosfer pedesaan tempo dulu. Selain itu, nuansa malam juga damai dan malam plus pencahayaan yang remang-remang, karena memang pakai lampu Sentir (lampu minyak). Jadi asik banget kalau untuk nongkrong lama-lama.",Semarang,Budaya
Hutan Wisata Tinjomoyo Semarang,3,"Awalnya taman wisata hutan Tinjomoyo Semarang (smg) ini merupakan sebuah kebun binatang dengan ragam binatang hutan di dalamnya. Namun terjadi banjir besar, hingga memutuskan jembatan besar yang menjadi akses utama menuju hutan wisata. Hutan Tinjomoyo sendiri memiliki kontur wilayah dengan perpaduan bukit, sungai dan hutan. Tumbuhan yang paling banyak terdapat di sini adalah vegetasi pohon jati serta pinus. Oleh karena itu, tak heran jika kawasan ini cocok sekali dijadikan hutan wisata yang masih alami.Dengan luas lahan 57,5 hektare area tersebut lebih sering dimanfaatkan sebagai tempat berkemah",Semarang,Cagar Alam
Taman Kasmaran,4,"Taman Kasmaran terletak di sebelah kiri Pasar Bunga. Gedung food court dan Taman Kasmaran dibangun dua lantai. Lantai bawah utuk spot dijadikan wisata kuliner, sementara lantai atas menjadi taman. Tidak sekadar taman biasa, Taman Kasmaran itu dilengkapi dengan pemandangan yang amat menarik dengan background Kampung Pelangi. Taman Kasmaran cukup luas, dilengkapi perabotan kursi dan meja ala kafe. Lokasi baru ini diyakini akan menjadi spot alternatif selfie terbaru di Kota Semarang.",Semarang,Taman Hiburan
Masjid Agung Ungaran,5,"Masjid Agung Al-Mabrur berlokasi di Jln. Ahmad Yani, Desa Sidomulyo, Kecamatan Ungaran Tibur, Kabupaten Semarang, Provinsi Jawa Tengah. Masjid ini juga menjadi Masjid Agung Bagi Kabupaten Semarang, Ibukota Provinsi Jawa Tengah. Masjid Agung Al-Mabrur juga dikenal sebelumnya dengan Masjid Ikatan Persaudaraan Haji Indonesia (IPHI). Pembangunan masjid ini dimulai pada tahun 2010 silam dengan pendirian yang mengambil lahan seluas 3.200 meter persegi, dengan luas bangunannya sekitar 1.550 persegi. Karena memang ditujukan untuk menjadi Masjid Agung Kota Semarang, maka bangunan masjid ini pun didirikan tepat menghadap Alun-Alun Kota Semarang, atau lebih dikenal sebagai “Alun-Alun Asmara” dan berseberangan dengan Rumah Dinas Bupati Semarang.",Semarang,Tempat Ibadah
Pantai Baruna,2,"kunjungi Pantai Baruna yang berada di Kota Semarang, Jawa Tengah! Pantai yang satu ini akan memberikan pengalaman wisata yang berbeda. Pasalnya, di sini tidak ada hamparan pasir. Memang Pantai Baruna merupakan objek wisata ‘tidak resmi’ milik Kota Semarang. Pantai ini berada di belakang kawasan pabrik semen. Sehingga tidak ada kepadatan wisatawan atau tempat berselancar di sini. Yang ada hanyalah hamparan padang rumput dan ilalang di hadapan Laut Jawa yang tenang.",Semarang,Bahari
Semarang Contemporary Art Gallery,3,Salah satu wisata yang berbau seni di Semarang bisa kamu temukan di kawasan Kota Lama yakni Semarang Contemporary Art Gallery atau lebih mudahnya disebut sebagai Galsem yang berarti Galeri Semarang. Semarang Gallery ini adalah salah satu museum seni yang cukup terkenal dan sampai saat ini masih sangat populer di kalangan wisatawan terutama para pecinta seni. Karya-karya seni yang dipamerkan disini merupakan hasil tangan dingin para seniman handal dari seluruh penjuru Nusantara.,Semarang,Budaya
Wisata Eling Bening,2,"Sebuah fasilitas wisata yang dikelola dengan cara modern, untuk menimbulkan kenikmatan berwisata seperti halnya yang diinginkan oleh anak-anak muda. Namun tetap menyatu dengan lingkungan, dengan keindahan alam. Tanpa melakukan kerusakan terhadap alam. Fasilitas wisata ini adalah wisata Eling Bening di perbukitan Ngrawan. Eling Bening sejatinya sebuah Restoran yang mengusung konsep wisata keluarga. Eling Bening menawarkan pemandangan alam yang sangat indah dengan view utama Rawa Pening. Keindahan itu disempurnakan lagi dengan  adanya background Gunung Merbabu, Andong dan Telomoyo, yang terlihat berdiri dengan gagah.
",Semarang,Cagar Alam
Pantai Marina,5,"Pantai Marina (bahasa Jawa: ꦥꦱꦶꦱꦶꦂ​ꦩꦫꦶꦤ, translit. Pasisir Marina) adalah salah satu objek wisata pantai yang berada di kota Semarang, Jawa Tengah. Pantai ini menyimpan pemandangan eksotis khas kota Semarang. Dahulu, tempat ini merupakan hutan bakau dan tambak, tapi pemerintah setempat mengubahnya menjadi tempat rekreasi dengan cara reklamasi daratan. Hasil reklamasi dari hutan bakau ini, sekarang berupa perumahan, pertokoan, dan perkantoran, di sebelah selatan pantai.
",Semarang,Bahari
Semarang Contemporary Art Gallery,5,Salah satu wisata yang berbau seni di Semarang bisa kamu temukan di kawasan Kota Lama yakni Semarang Contemporary Art Gallery atau lebih mudahnya disebut sebagai Galsem yang berarti Galeri Semarang. Semarang Gallery ini adalah salah satu museum seni yang cukup terkenal dan sampai saat ini masih sangat populer di kalangan wisatawan terutama para pecinta seni. Karya-karya seni yang dipamerkan disini merupakan hasil tangan dingin para seniman handal dari seluruh penjuru Nusantara.,Semarang,Budaya
Wisata Mangrove Tapak,4,"Wisata hutan mangrove Semarang hampir tak pernah sepi dikunjungi wisatawan. Tak jarang pengunjung yang datang ke wisata cantik ini baik berswafoto maupun sekedar jalan-jalan menapaik selasar kayu. Obyek ini pun juga instagramable dan pas dibagikan di sosmed, bahkan banyak diburu oleh mereka yang berkecimpung di bidang fotografi.",Semarang,Cagar Alam
Tirto Argo Siwarak,4,"Kolam Renang Tirto Argo Siwarak, merupakan kolam renang yang berada di Ungaran. Keberadaannya yang dekat dengan Kota Semarang menjadikan tempat wisata ini cukup populer. Bahkan, tidak jarang wisatawan Semarang dan sekitarnya datang berkunjung. Hadir dengan kolam renang dan taman rekreasi sederhana, justru menjadi daya tarik tersendiri. Terbukti, pengunjung yang datang tidak pernah surut. Bahkan, selalu ada pengunjung dan ramai ketika liburan.",Semarang,Taman Hiburan
Danau Rawa Pening,3,"Rawa Pening (pening adalah salah satu varian bahasa Jawa dari kata ""wening"" yang artinya hening, tenang, damai) (bahasa Jawa: ꦫꦮ​ꦥꦼꦤꦶꦁ, translit. Rawa Pening) adalah danau alam di Kabupaten Semarang, Jawa Tengah. Dengan luas 2.670 hektare ia menempati wilayah Kecamatan Ambarawa, Bawen, Tuntang, dan Banyubiru.Rawa Pening terletak di cekungan terendah lereng Gunung Merbabu, Gunung Telomoyo, dan Gunung Ungaran. Danau ini dangkal dan menjadi hulu bagi Sungai Tuntang.
",Semarang,Cagar Alam
Air Terjun Semirang,2,"Terletak di lereng Gunung Ungaran bagian utara, terdapat sebuah air terjun yang eksotis dengan kolam renang yang berwarna hijau yang dikelilingi popohonan dan kesejukan udara pegunungan. Nama lokasi tersebut adalah Air Terjun Semirang atau disebut juga Curug Semirang. Dan masyarakat Semarang menyebutnya dengan Curug Semarang. Karena keindahannya lokasi wisata ini sering dikunjungi oleh para wisatawan pada saat hari-hari biasa, apalagi saat liburan tiba. Air terjun Semirang atau Curug Semirang berada di kawasan hutan lindung dengan luas 10 hektar di bawah pengelolaan perum perhutani. Adapun air terjun ini memiliki ketinggian sekitar 45 meter. Jarak lokasi parkiran dengan lokasi air terjun sekitar 500 meter. Dan selama perjalanan, para pengunjung akan disuguhkan pemandangan alam yang masih asri dengan kesegaran udara yang sangat sejuk.",Semarang,Cagar Alam
Air Terjun Kali Pancur,4,"Kali Pancur Getasan merupakan kawasan wisata alam Air Terjun Kali Pancur ini berada di Desa Nogosaren, Kecamatan Getasan, Kabupaten Semarang, sekitar 14 km sebelah barat Kota Salatiga. Untuk menuju ke lokasi objek wisata ini tidak ada sarana transportasi umum, jadi harus membawa kendaraan sendiri.",Semarang,Cagar Alam
Saloka Theme Park,4,"SALOKA hadir sebagai taman rekreasi terbesar di Tengah Jawa yang masuk dalam daftar destinasi wisata Pesona Indonesia, serta mengusung konsep kearifan lokal berdasarkan legenda rakyat Baru Klinthing.",Semarang,Taman Hiburan
Masjid Kapal Semarang,2,"Masjid Safinatun Najah atau pengunjung biasa menyebutnya dengan Masjid Kapal Semarang kini menjadi wisata religi yang ramai dikunjungi saat bulan Ramadan. Masjid yang berlokasi di berlokasi di Jalan Kyai Padak, Podorejo, Kec. Ngaliyan, Kota Semarang mulai ramai didatangi pengunjung saat menjelang buka puasa. Umumnya tujuan utama mereka yang datang kesini untuk beribadah, selain itu juga ada yang berburu foto serta berkuliner di sekitar kawasan masjid.",Semarang,Tempat Ibadah
Flower Farm Setiya Aji,5,"Di taman bunga Setiya Aji Flower Farm kita bisa melihat warna-warni bunga krisan yang terlihat sangat cantik. Selain itu lokasinya yang berada di dataran tinggi membuat udara di kebun bunga Bandungan ini terasa cukup segar. Taman bunga Setiya Aji Flower Farm Bandungan ini dalam sekejab menarik perhatian wisatawan, terutama kalangan anak muda yang penasaran ingin melihat keindahan bunga-bunga di tempat wisata Semarang tersebut. Kini Setiya Aji Flower Farm menjadi salah satu tempat wisata favorit di Bandungan yang wajib dikunjungi, terutama bagi wisatawan yang sedang mencari objek wisata romantis di Kabupaten Semarang selain di Gedong Songo.",Semarang,Cagar Alam
